{
  "$schema": "./lite-html53-css21-es2020-profile.schema.json",
  "schemaVersion": 2,
  "name": "Lite HTML 5.3/CSS 2.1/ES2020 compatibility profile",
  "claim": "development-non-conforming",
  "platform": {
    "operatingSystem": "Windows",
    "architecture": "x64",
    "cssMedia": "screen"
  },
  "targets": [
    {
      "id": "html53",
      "title": "HTML 5.3, W3C Working Draft 18 October 2018",
      "url": "https://www.w3.org/TR/2018/WD-html53-20181018/"
    },
    {
      "id": "css21",
      "title": "Cascading Style Sheets Level 2 Revision 1",
      "url": "https://www.w3.org/TR/2011/REC-CSS2-20110607/"
    },
    {
      "id": "es2020",
      "title": "ECMA-262, 11th edition, June 2020",
      "url": "https://262.ecma-international.org/11.0/"
    }
  ],
  "coverage": {
    "normativeClauseInventoryComplete": false,
    "unmappedApplicableClauseStatus": "untested",
    "statusResolution": "most-specific-entry-wins; otherwise unmappedApplicableClauseStatus",
    "html53ClauseInventoryComplete": false,
    "html53TestInventoryComplete": false,
    "html53RequiredDependencies": []
  },
  "requirements": [
    {
      "id": "html53.2",
      "specification": "html53",
      "clause": "2",
      "url": "https://www.w3.org/TR/2018/WD-html53-20181018/infrastructure.html#infrastructure",
      "title": "Common infrastructure",
      "applicability": "included",
      "status": "untested",
      "tests": [],
      "implementationAreas": [
        "Lite/Parser.cs",
        "Lite/Network",
        "Lite/Scripting"
      ]
    },
    {
      "id": "html53.3",
      "specification": "html53",
      "clause": "3",
      "url": "https://www.w3.org/TR/2018/WD-html53-20181018/dom.html#dom",
      "title": "Semantics, structure, and APIs of HTML documents",
      "applicability": "included",
      "status": "untested",
      "tests": [],
      "implementationAreas": [
        "Lite/Parser.cs",
        "Lite/Scripting/Dom"
      ]
    },
    {
      "id": "html53.4",
      "specification": "html53",
      "clause": "4",
      "url": "https://www.w3.org/TR/2018/WD-html53-20181018/semantics.html#semantics",
      "title": "The elements of HTML",
      "applicability": "included",
      "status": "untested",
      "tests": [],
      "implementationAreas": [
        "Lite/Parser.cs",
        "Lite/Scripting/Dom",
        "Lite/Layout",
        "Lite/Drawer.cs"
      ]
    },
    {
      "id": "html53.6",
      "specification": "html53",
      "clause": "6",
      "url": "https://www.w3.org/TR/2018/WD-html53-20181018/browsers.html#browsers",
      "title": "Loading Web pages",
      "applicability": "included",
      "status": "untested",
      "tests": [],
      "implementationAreas": [
        "Lite/BrowserWindow.cs",
        "Lite/Parser.cs",
        "Lite/Scripting"
      ]
    },
    {
      "id": "html53.7",
      "specification": "html53",
      "clause": "7",
      "url": "https://www.w3.org/TR/2018/WD-html53-20181018/webappapis.html#webappapis",
      "title": "Web application APIs",
      "applicability": "included",
      "status": "untested",
      "tests": [],
      "implementationAreas": [
        "Lite/Scripting"
      ]
    },
    {
      "id": "html53.5",
      "specification": "html53",
      "clause": "5",
      "url": "https://www.w3.org/TR/2018/WD-html53-20181018/editing.html#editing",
      "title": "User interaction",
      "applicability": "included",
      "status": "untested",
      "tests": [],
      "implementationAreas": [
        "Lite/Interaction",
        "Lite/Scripting/Dom"
      ]
    },
    {
      "id": "html53.8",
      "specification": "html53",
      "clause": "8",
      "url": "https://www.w3.org/TR/2018/WD-html53-20181018/syntax.html#syntax",
      "title": "The HTML syntax",
      "applicability": "included",
      "status": "untested",
      "tests": [],
      "implementationAreas": [
        "Lite/Parser.cs"
      ]
    },
    {
      "id": "html53.9",
      "specification": "html53",
      "clause": "9",
      "url": "https://www.w3.org/TR/2018/WD-html53-20181018/xhtml.html#xhtml",
      "title": "The XML syntax",
      "applicability": "included",
      "status": "untested",
      "tests": [],
      "implementationAreas": [
        "Lite/Parser.cs"
      ]
    },
    {
      "id": "html53.10",
      "specification": "html53",
      "clause": "10",
      "url": "https://www.w3.org/TR/2018/WD-html53-20181018/rendering.html#rendering",
      "title": "Rendering",
      "applicability": "included",
      "status": "untested",
      "tests": [],
      "implementationAreas": [
        "Lite/Layout",
        "Lite/Drawer.cs"
      ]
    },
    {
      "id": "html53.4.11.details-open",
      "specification": "html53",
      "clause": "4.11.1 details open state",
      "url": "https://www.w3.org/TR/2018/WD-html53-20181018/interactive-elements.html#the-details-element",
      "title": "details open boolean attribute reflection",
      "applicability": "included",
      "status": "implemented",
      "tests": [
        {
          "suite": "wpt",
          "path": "lite/html53/details-reflection.html",
          "assertion": "The details open IDL attribute reflects presence of the boolean content attribute"
        }
      ],
      "implementationAreas": [
        "Lite/Parser.cs",
        "Lite/Layout/BoxEngine.cs",
        "Lite/Scripting/Dom/JsElement.cs"
      ],
      "notes": "Limited to the named assertion; the containing section remains untested until its complete normative inventory is covered."
    },
    {
      "id": "html53.4.11.details-toggle",
      "specification": "html53",
      "clause": "4.11.1 details notification task steps",
      "url": "https://www.w3.org/TR/2018/WD-html53-20181018/interactive-elements.html#the-details-element",
      "title": "Runtime open attribute changes queue and coalesce details toggle notifications",
      "applicability": "included",
      "status": "implemented",
      "tests": [
        {
          "suite": "wpt",
          "path": "lite/html53/details-toggle.html",
          "assertion": "Attribute presence changes coalesce into a trusted non-bubbling non-cancelable toggle event"
        },
        {
          "suite": "unit",
          "path": "Lite.Tests/DomTests.cs#Details_ToggleCoalescingKeepsTheLatestTaskPosition"
        }
      ],
      "implementationAreas": [
        "Lite/Scripting/Dom/JsElement.cs",
        "Lite/Models/LayoutNode.cs"
      ],
      "notes": "Only runtime attribute mutations and notification coalescing are covered. Parser-created open attributes, complete DOM task-source scheduling, summary activation, and rendering remain separate untested obligations."
    },
    {
      "id": "html53.4.7.iframe-initial-document",
      "specification": "html53",
      "clause": "4.7.6 iframe initial document",
      "url": "https://www.w3.org/TR/2018/WD-html53-20181018/semantics-embedded-content.html#the-iframe-element",
      "title": "iframe without src or srcdoc has an initial HTML document",
      "applicability": "included",
      "status": "implemented",
      "tests": [
        {
          "suite": "wpt",
          "path": "lite/html53/iframe-initial-document.html",
          "assertion": "An iframe without src or srcdoc has a non-null initial HTML document"
        }
      ],
      "implementationAreas": [
        "Lite/Parser.cs",
        "Lite/Scripting/Dom/JsElement.cs"
      ],
      "notes": "Limited to the named assertion; the containing section remains untested until its complete normative inventory is covered."
    },
    {
      "id": "html53.profile.browser-chrome",
      "specification": "html53",
      "clause": "Profile boundary: browser chrome",
      "url": "https://www.w3.org/TR/2018/WD-html53-20181018/",
      "title": "Browser chrome and end-user browser UI",
      "applicability": "excluded",
      "status": "profile-excluded",
      "tests": [],
      "implementationAreas": [],
      "exclusionReason": "Lite is an embeddable rendering engine; browser chrome is supplied by a host."
    },
    {
      "id": "html53.profile.accessibility-platform",
      "specification": "html53",
      "clause": "Profile boundary: accessibility platform mappings",
      "url": "https://www.w3.org/TR/2018/WD-html53-20181018/",
      "title": "Operating-system accessibility API mappings",
      "applicability": "excluded",
      "status": "profile-excluded",
      "tests": [],
      "implementationAreas": [],
      "exclusionReason": "Platform accessibility mappings are outside this compatibility profile; DOM semantics remain included."
    },
    {
      "id": "html53.profile.network-stack",
      "specification": "html53",
      "clause": "Profile boundary: general-purpose networking implementation",
      "url": "https://www.w3.org/TR/2018/WD-html53-20181018/infrastructure.html",
      "title": "General-purpose HTTP and TLS implementation",
      "applicability": "excluded",
      "status": "profile-excluded",
      "tests": [],
      "implementationAreas": [
        "Lite/Network"
      ],
      "exclusionReason": "Transport is injected by the host. HTML-visible origin, CORS, redirect, referrer, MIME, and resource metadata behavior remains included."
    },
    {
      "id": "css21.4-7",
      "specification": "css21",
      "clause": "4-7",
      "url": "https://www.w3.org/TR/2011/REC-CSS2-20110607/syndata.html",
      "title": "Syntax, selectors, cascade, and media",
      "applicability": "included",
      "status": "untested",
      "tests": [],
      "implementationAreas": [
        "Lite/Parser.cs",
        "Lite/Layout/StyleResolver.cs"
      ]
    },
    {
      "id": "css21.8-10",
      "specification": "css21",
      "clause": "8-10",
      "url": "https://www.w3.org/TR/2011/REC-CSS2-20110607/box.html",
      "title": "Box model and visual formatting model",
      "applicability": "included",
      "status": "untested",
      "tests": [],
      "implementationAreas": [
        "Lite/Layout"
      ]